[
  {
    "prospect_name": "Dusty CindySue Hamrick",
    "url": "",
    "source": "x",
    "industry": "Unknown",
    "signals": [
      "What If Your Business Never Missed Another Opportunity?\n\nMost small businesses miss calls. Miss messages. Miss follow-ups.\nThat\u2019s where an AI Assistant comes in.\n\nAn AI Assistant can:\n\u2022 Answer calls a"
    ],
    "contact_info": {},
    "discovered_at": "2026-01-20T23:37:16.940604",
    "x_handle": "DustyCindysue",
    "x_post_url": "https://x.com/DustyCindysue/status/2012275243281433059",
    "notes": "Found via X search",
    "score": 0,
    "recommended_action": "IGNORE"
  },
  {
    "prospect_name": "Ringmate",
    "url": "",
    "source": "x",
    "industry": "Unknown",
    "signals": [
      "@LoicBerthelot I build a system to help small business capture revenue on missed calls! Im at a point now where I am wanting to bring someone on to start creating their own client book. \nDo you have a"
    ],
    "contact_info": {},
    "discovered_at": "2026-01-20T23:37:16.940604",
    "x_handle": "Ringmate256582",
    "x_post_url": "https://x.com/Ringmate256582/status/2011598384189358549",
    "notes": "Found via X search",
    "score": 4,
    "recommended_action": "REVIEW"
  },
  {
    "prospect_name": "Prosprus",
    "url": "https://t.co/ngczubl2z8",
    "source": "x",
    "industry": "Unknown",
    "signals": [
      "38% of small business calls go unanswered: think of all those missed opportunities! With voice AI from https://t.co/i6TrEtJKfL, every call gets a response, appointments are booked 24/7, and your busin"
    ],
    "contact_info": {},
    "discovered_at": "2026-01-20T23:37:16.940604",
    "x_handle": "prosprusllc",
    "x_post_url": "https://x.com/prosprusllc/status/2011363000465166461",
    "notes": "Found via X search",
    "score": 1,
    "recommended_action": "IGNORE"
  },
  {
    "prospect_name": "Atish kumar",
    "url": "",
    "source": "x",
    "industry": "Unknown",
    "signals": [
      "@HDFC_Bank @HDFCBank_Cares says that the customer service is available till 8 pm, it's 7:40pm I am trying to call for 10 min. Just ringing, no one is answering... @RBI when I need the help, they are u"
    ],
    "contact_info": {},
    "discovered_at": "2026-01-20T23:37:17.105654",
    "x_handle": "Atishku41480248",
    "x_post_url": "https://x.com/Atishku41480248/status/2013253371839582473",
    "notes": "Found via X search",
    "score": 2,
    "recommended_action": "IGNORE"
  },
  {
    "prospect_name": "LovetteNeri",
    "url": "",
    "source": "x",
    "industry": "Unknown",
    "signals": [
      "@LBCexpress \n\nHi LBC TN# 362441203639. It is more than a week the package has been sent yet no update from your end. Your hub and customer service are not answering. This package is a medicine. I have"
    ],
    "contact_info": {},
    "discovered_at": "2026-01-20T23:37:17.105654",
    "x_handle": "lov_ette",
    "x_post_url": "https://x.com/lov_ette/status/2013080100166922680",
    "notes": "Found via X search",
    "score": 2,
    "recommended_action": "IGNORE"
  },
  {
    "prospect_name": "Karandeep Bhambra \ud83e\udd85",
    "url": "",
    "source": "x",
    "industry": "Unknown",
    "signals": [
      "@IndiGo6E  Lost my bag on flight 6E-1346/26 from Doha to New Delhi \u2013 it's been months and NO ONE is answering calls/emails! Unacceptable service! Need immediate update &amp; compensation. #IndiGoFail "
    ],
    "contact_info": {},
    "discovered_at": "2026-01-20T23:37:17.105654",
    "x_handle": "kdbhambra",
    "x_post_url": "https://x.com/kdbhambra/status/2012874593619378539",
    "notes": "Found via X search",
    "score": 2,
    "recommended_action": "IGNORE"
  },
  {
    "prospect_name": "sampa Sardar",
    "url": "",
    "source": "x",
    "industry": "Unknown",
    "signals": [
      "@Flipkart @flipkartsupport @FlipkartStoriesFlipkart grocery service is pathetic. after mentioning the delivery date still not able to deliver on that day. Even they can't cancel or give refund Custome"
    ],
    "contact_info": {},
    "discovered_at": "2026-01-20T23:37:17.105654",
    "x_handle": "SardarSamp56325",
    "x_post_url": "https://x.com/SardarSamp56325/status/2012790166323114480",
    "notes": "Found via X search",
    "score": 0,
    "recommended_action": "IGNORE"
  },
  {
    "prospect_name": "Jonatan | Ai Expert for Small Businesses",
    "url": "",
    "source": "x",
    "industry": "Unknown",
    "signals": [
      "Your receptionist costs $3,000/month. AI receptionists cost $99/month, answer 24/7, never call in sick, and book appointments while you sleep. Small business owners are slow to adopt this. That's your"
    ],
    "contact_info": {},
    "discovered_at": "2026-01-20T23:37:17.235800",
    "x_handle": "AiJonatan",
    "x_post_url": "https://x.com/AiJonatan/status/2011666947747037218",
    "notes": "Found via X search",
    "score": 4,
    "recommended_action": "REVIEW"
  },
  {
    "prospect_name": "James",
    "url": "",
    "source": "x",
    "industry": "Unknown",
    "signals": [
      "@mhp_guy Chris this actually speaks to my experience with trying to sell AI front desk agents. After 40 hours of tinkering and crafting and 100 cold calls and texts, almost nobody is interested.offere"
    ],
    "contact_info": {},
    "discovered_at": "2026-01-20T23:37:17.413587",
    "x_handle": "Datascience89",
    "x_post_url": "https://x.com/Datascience89/status/2013806702248792329",
    "notes": "Found via X search",
    "score": 0,
    "recommended_action": "IGNORE"
  },
  {
    "prospect_name": "Teresa Appel",
    "url": "",
    "source": "x",
    "industry": "Unknown",
    "signals": [
      "My phone auto-transcribes voicemails.\nIt made a choice.\n\n\u201cIf you were Teresa\u2026\u201d\nI was\u2026until this voicemail.\n\nPress 1 if you exist.\nPress 2 if you\u2019re also from Hell. \ud83d\udd25\ud83d\ude08\n\nRegardless of my current existen"
    ],
    "contact_info": {},
    "discovered_at": "2026-01-20T23:37:17.565226",
    "x_handle": "VOGlitter",
    "x_post_url": "https://x.com/VOGlitter/status/2013663842132205969",
    "notes": "Found via X search",
    "score": 0,
    "recommended_action": "IGNORE"
  },
  {
    "prospect_name": "Hector Samuels\ud83c\udde6\ud83c\uddfa\ud83c\uddee\ud83c\uddf9\ud83c\uddfa\ud83c\uddf8",
    "url": "",
    "source": "x",
    "industry": "Unknown",
    "signals": [
      "@caitoz Mandy Sacher insanely hallucinated gunshots from harmless pocket-dial creaks/snoring in a dead-silent voicemail, then frantically sicced the cops on a disabled woman\u2014unleashing hate-crime hell"
    ],
    "contact_info": {},
    "discovered_at": "2026-01-20T23:37:17.565226",
    "x_handle": "HS19661966",
    "x_post_url": "https://x.com/HS19661966/status/2012339000548168163",
    "notes": "Found via X search",
    "score": 0,
    "recommended_action": "IGNORE"
  },
  {
    "prospect_name": "Roy Sholay \ud83c\uddf2\ud83c\uddfa\ud83e\udda4",
    "url": "",
    "source": "x",
    "industry": "Unknown",
    "signals": [
      "A voiceless voicemail made her nervous because there were noises like gunshots\u2026.fucking Hell. https://t.co/yqbOzg77Zc"
    ],
    "contact_info": {},
    "discovered_at": "2026-01-20T23:37:17.565226",
    "x_handle": "ephemeral1107",
    "x_post_url": "https://x.com/ephemeral1107/status/2012135230795366783",
    "notes": "Found via X search",
    "score": 0,
    "recommended_action": "IGNORE"
  },
  {
    "prospect_name": "lergus shoelace",
    "url": "",
    "source": "x",
    "industry": "Unknown",
    "signals": [
      "Dude he chilled out in the hallway for like 10 mins, rang me 3 different times, and then didn't leave a voicemail or a warrant or some kind of warning on my door. What the hell I didn't even do anythi"
    ],
    "contact_info": {},
    "discovered_at": "2026-01-20T23:37:17.565226",
    "x_handle": "s_p_n_z",
    "x_post_url": "https://x.com/s_p_n_z/status/2011566768339538159",
    "notes": "Found via X search",
    "score": 0,
    "recommended_action": "IGNORE"
  },
  {
    "prospect_name": "\ud83c\udfd2osephine MET 5SOS | \u203a\u203a\u203a\u203a",
    "url": "",
    "source": "x",
    "industry": "Unknown",
    "signals": [
      "HARRY STYLES WHAT THE HELL I JUST SAT DOWN ON MY FIRST DISNEY RIDE OF THE DAY WHEN THAT VOICEMAIL CAME THROUGH"
    ],
    "contact_info": {},
    "discovered_at": "2026-01-20T23:37:17.565226",
    "x_handle": "jcatala711",
    "x_post_url": "https://x.com/jcatala711/status/2011488901957923239",
    "notes": "Found via X search",
    "score": 0,
    "recommended_action": "IGNORE"
  },
  {
    "prospect_name": "ara",
    "url": "",
    "source": "x",
    "industry": "Unknown",
    "signals": [
      "Sendin' me straight to voicemail, suga, what the hell? (What the hell?)"
    ],
    "contact_info": {},
    "discovered_at": "2026-01-20T23:37:17.565226",
    "x_handle": "remoiver",
    "x_post_url": "https://x.com/remoiver/status/2011378806230224967",
    "notes": "Found via X search",
    "score": 0,
    "recommended_action": "IGNORE"
  },
  {
    "prospect_name": "Elysia",
    "url": "",
    "source": "x",
    "industry": "Unknown",
    "signals": [
      "Sendin' me straight to voicemail, suga, what the hell? (What the hell?)"
    ],
    "contact_info": {},
    "discovered_at": "2026-01-20T23:37:17.565226",
    "x_handle": "berhitsung",
    "x_post_url": "https://x.com/berhitsung/status/2011328480773017933",
    "notes": "Found via X search",
    "score": 0,
    "recommended_action": "IGNORE"
  },
  {
    "prospect_name": "AI Answering Service for Home Services, Legal, & Medical | ZyraTalk",
    "url": "https://www.zyratalk.com",
    "source": "web",
    "industry": "HVAC",
    "signals": [
      "missed calls?",
      "after hours",
      "receptionist"
    ],
    "contact_info": {
      "phone": "(888)435-9109",
      "email": "support@zyratalk.co"
    },
    "discovered_at": "2026-01-20T23:37:18.064892",